<?xml version="1.0" encoding="UTF-8"?>
<pe:eventList 
   xmlns:xsi="http://www.w3.org/2001/XMLSchema-instance" 
   xmlns="http://www.w3.org/1999/xhtml" 
   xmlns:pe="http://www.processpuzzle.com/PartyEvent"
   xsi:schemaLocation="http://www.processpuzzle.com/PartyEvent http://processpuzzle.com/Schemas/PartyEvent.xsd">
      
   <pe:events>
      <pe:event>
         <pe:title>Unit Test Driven JavaScript Development - Training</pe:title>
         <pe:link>Content/WidgetExamples/EventDetail.xml?contentUri='Content/WidgetExamples/UpcommingEvents.xml'&amp;documentVariables={index:'1'}&amp;documentType=SMART</pe:link>
         <pe:description>Introduction to Test Driven Development for JavaScript developers.</pe:description>
         <pe:program>
            <pe:description href="Content/DynamicDocument.xml?contentUri='Content/DynamicContent.xml'&amp;documentType=SMART">Detailed agenda</pe:description>
            <pe:link>http://processpuzzle.com/#!WebUIController: {locale: 'en'}; communityTabs: {currentTabId: 'tab_CommunityTab.faceBook'}; consoleTabs: {currentTabId: 'tab_ConsoleTab.comments'}; verticalMenuColumn: {currentItemId: 'Development-BeginnersTrainings', contextItemId: 'Development'}; horizontalMenuBar: {currentItemId: 'Development', contextItemId: 'MenuWidget'}</pe:link>
         </pe:program>
         <pe:schedule isFullDay="false">
            <pe:startDate>Tue, 10 Jun 2003 04:00:00 GMT</pe:startDate>
            <pe:endDate>Tue, 10 Jun 2003 08:00:00 GMT</pe:endDate>
         </pe:schedule>
         <pe:location>
            <pe:address>Prof. Agile - virtual classroom</pe:address>
            <pe:link>http://agilerenovation.com</pe:link>
         </pe:location>
         <pe:language>English</pe:language>
         <pe:registration>
            <pe:link href="http://processpuzzle.eventbrite.com/">http://processpuzzle.eventbrite.com/</pe:link>
         </pe:registration>
         <pe:publicationDate>Tue, 10 Jun 2003 04:00:00 GMT</pe:publicationDate>
      </pe:event>  
       
      <pe:event>
         <pe:title>Acceptance Test Driven Java Development - Training</pe:title>
         <pe:link>Content/WidgetExamples/EventDetail.xml?contentUri='Content/WidgetExamples/UpcommingEvents.xml'&amp;documentVariables={index:'2'}&amp;documentType=SMART</pe:link>
         <pe:description>Introduction to Acceptance Test Driven Development for Java developers.</pe:description>
         <pe:program>
            <pe:description href="Content/DynamicDocument.xml?contentUri='Content/DynamicContent.xml'&amp;documentType=SMART">Detailed agenda</pe:description>
            <pe:link>http://processpuzzle.com/#!WebUIController: {locale: 'en'}; communityTabs: {currentTabId: 'tab_CommunityTab.faceBook'}; consoleTabs: {currentTabId: 'tab_ConsoleTab.comments'}; verticalMenuColumn: {currentItemId: 'Development-BeginnersTrainings', contextItemId: 'Development'}; horizontalMenuBar: {currentItemId: 'Development', contextItemId: 'MenuWidget'}</pe:link>
         </pe:program>
         <pe:schedule isFullDay="false">
            <pe:startDate></pe:startDate>
            <pe:endDate></pe:endDate>
         </pe:schedule>
         <pe:location>
            <pe:address>Prof. Agile - virtual classroom</pe:address>
            <pe:link>http://agilerenovation.com</pe:link>
         </pe:location>
         <pe:language>English</pe:language>
         <pe:registration>
            <pe:link href="http://processpuzzle.eventbrite.com/">http://processpuzzle.eventbrite.com/</pe:link>
         </pe:registration>
         <pe:publicationDate>Tue, 03 Jun 2003 09:39:21 GMT</pe:publicationDate>
      </pe:event>  
   </pe:events> 
</pe:eventList>
